{
  "name": "aiverse",
  "owner": {
    "name": "Piotr Zaniewski",
    "email": "piotr@cloudrumble.net"
  },
  "metadata": {
    "description": "A universe of AI-augmented development utilities, inspired by Unix philosophy",
    "version": "1.0.1",
    "homepage": "https://github.com/Piotr1215/aiverse",
    "keywords": [
      "ai",
      "development",
      "workflow",
      "terminal",
      "mcp",
      "utilities"
    ]
  },
  "plugins": [
    {
      "name": "ai-coreutils",
      "source": {
        "source": "github",
        "repo": "Piotr1215/ai-coreutils",
        "branch": "main"
      },
      "description": "Essential AI-augmented dev utilities (commands, agents, hooks)",
      "version": "0.1.0",
      "author": {
        "name": "Piotr Zaniewski"
      },
      "category": "productivity",
      "keywords": [
        "development",
        "utilities",
        "coreutils",
        "documentation",
        "testing"
      ],
      "strict": true
    },
    {
      "name": "vale-lsp",
      "source": "./plugins/vale-lsp",
      "description": "Vale prose linter LSP for markdown and MDX files",
      "version": "1.0.0",
      "author": {
        "name": "Piotr Zaniewski"
      },
      "category": "development",
      "strict": false,
      "lspServers": {
        "vale-ls": {
          "command": "vale-ls",
          "extensionToLanguage": {
            ".md": "markdown",
            ".mdx": "mdx"
          }
        }
      }
    },
    {
      "name": "design-kit",
      "source": "./plugins/design-kit",
      "description": "Test-driven, parallel-execution framework for building complex systems with confidence \u2014 prove components in isolation, then integrate via contracts.",
      "version": "0.1.5",
      "author": {
        "name": "Piotr Zaniewski"
      },
      "category": "productivity",
      "keywords": [
        "design",
        "tdd",
        "workflow",
        "parallel",
        "contracts",
        "linear"
      ],
      "strict": true
    },
    {
      "name": "bgloop",
      "source": "./plugins/bgloop",
      "description": "Background AI loop: a session event leaves for a detached one-shot observer and a bounded action comes back to that same session.",
      "version": "0.1.0",
      "author": {
        "name": "Piotr Zaniewski"
      },
      "category": "productivity",
      "keywords": [
        "observer",
        "hooks",
        "coach",
        "background",
        "ledger"
      ],
      "strict": true
    }
  ]
}
